{
  "$schema": "schemas/current-corpus-map-v1.schema.json",
  "schema": "agi.current_corpus_map.v1",
  "schema_version": "1.0.0",
  "map_id": "urn:ivankotov:corpus-map:public:2026-08-07",
  "last_verified": "2026-08-07",
  "canonical_owner": {
    "name": "Ivan Kotov",
    "github": "Kot141078",
    "orcid": "https://orcid.org/0009-0009-6002-9845"
  },
  "scope": {
    "visibility": "public",
    "repository_count": 18,
    "description": "Current discovery snapshot for the public authored corpus, implementation-evidence repositories, literary repositories, and public navigation repositories.",
    "excluded": [
      "private repositories",
      "unpublished local work",
      "third-party mirrors",
      "generated GitHub source archives as integrity authorities"
    ]
  },
  "authority": {
    "map_status": "derived current-discovery snapshot",
    "authoritative_for": [
      "public repository membership observed on 2026-08-07",
      "repository roles and discovery routes",
      "the exact default-branch commits inspected on 2026-08-07",
      "routing between current branch views and immutable observed snapshots"
    ],
    "not_authoritative_for": [
      "the byte contents of DOI deposits or tagged releases",
      "a claim that a default-branch head is a release",
      "legal, clinical, safety, certification, personhood, consciousness, or deployment conclusions",
      "semantic ownership of payloads whose canonical home is another repository"
    ],
    "precedence": [
      "A DOI-bound or tag-bound manifest controls the bytes of that frozen release.",
      "A repository's own current machine metadata controls that repository's payload semantics.",
      "This map controls cross-repository discovery only and must not override either source above.",
      "The historical stack lock remains evidence of its dated snapshot and is not a current-repository inventory."
    ]
  },
  "claim_boundaries": [
    "Repository inclusion establishes discoverability, not endorsement or external validation.",
    "An observed default-branch commit establishes a reproducible inspection point, not a stable release.",
    "Research software and fixtures are implementation evidence, not universal safety proof or deployment authorization.",
    "Literary repositories provide the narrative and book layer; they do not replace technical or normative sources.",
    "The public site is a derived navigation and projection layer; canonical source and release records remain in their named repositories and DOI deposits.",
    "Archived navigation is retained for provenance and must not be treated as the current site."
  ],
  "current_pointer_policy": {
    "mutable_pointer": "current_pointer.branch_url and current_pointer.raw_branch_base",
    "immutable_observation": "current_pointer.observed_commit_url and current_pointer.raw_observed_base",
    "verification_rule": "Use observed_head_commit to reproduce this audit snapshot; re-resolve main for newer work and record a new last_verified date.",
    "release_rule": "Use a declared release tag, DOI record, and its manifest when release identity or byte integrity matters."
  },
  "historical_locks": [
    {
      "path": "STACK_LOCK_2026-04-12.json",
      "date": "2026-04-12",
      "status": "historical_snapshot",
      "sha256": "311260d60017bfba56f1f0f095e0a614a0d83a4bca04a921a047a54fb68c3583",
      "scope": "Five-repository aligned reading stack as recorded on 2026-04-12.",
      "boundary": "Retained unchanged for provenance. It is neither the current public-repository inventory nor an assertion of latest releases."
    }
  ],
  "repositories": [
    {
      "repository": "Kot141078/advanced-global-intelligence",
      "corpus_class": "research",
      "role": "primary technical corpus and cross-repository discovery entry",
      "lifecycle": "active",
      "authority_scope": "Canonical home for AGI ecosystem framing and AGI-hosted packages; discovery authority only for payloads canonically hosted elsewhere.",
      "current_pointer": {
        "ref_type": "branch",
        "ref": "main",
        "branch_url": "https://github.com/Kot141078/advanced-global-intelligence/tree/main",
        "raw_branch_base": "https://raw.githubusercontent.com/Kot141078/advanced-global-intelligence/main/",
        "observed_head_commit": "a0606a6768eb608347fd0709ac6569d3a9600ab3",
        "observed_commit_url": "https://github.com/Kot141078/advanced-global-intelligence/tree/a0606a6768eb608347fd0709ac6569d3a9600ab3",
        "raw_observed_base": "https://raw.githubusercontent.com/Kot141078/advanced-global-intelligence/a0606a6768eb608347fd0709ac6569d3a9600ab3/",
        "observed_at": "2026-08-07"
      },
      "declared_release": {
        "version": null,
        "version_source": null,
        "doi": "10.5281/zenodo.18311148",
        "doi_source": "CITATION.cff",
        "metadata_consistency": "repository_container_no_single_version",
        "note": "The repository contains multiple independently versioned packages; no single current repository version is asserted."
      },
      "entrypoints": [
        "MACHINE_ENTRY.md",
        "REPO_INDEX.json",
        "CORPUS_PRIMER.json",
        "MASTER_ENTRY.md"
      ]
    },
    {
      "repository": "Kot141078/ai-social-role-separation-memory-custody",
      "corpus_class": "research",
      "role": "technical note and memory-custody boundary",
      "lifecycle": "active",
      "authority_scope": "Canonical public package for separation and composition of AI social roles and custody of memory and interpretations.",
      "current_pointer": {
        "ref_type": "branch",
        "ref": "main",
        "branch_url": "https://github.com/Kot141078/ai-social-role-separation-memory-custody/tree/main",
        "raw_branch_base": "https://raw.githubusercontent.com/Kot141078/ai-social-role-separation-memory-custody/main/",
        "observed_head_commit": "f5d7263181492891032f213c7db1e0c25b701372",
        "observed_commit_url": "https://github.com/Kot141078/ai-social-role-separation-memory-custody/tree/f5d7263181492891032f213c7db1e0c25b701372",
        "raw_observed_base": "https://raw.githubusercontent.com/Kot141078/ai-social-role-separation-memory-custody/f5d7263181492891032f213c7db1e0c25b701372/",
        "observed_at": "2026-08-07"
      },
      "declared_release": {
        "version": "1.0",
        "version_source": "CITATION.cff",
        "doi": "10.5281/zenodo.21751985",
        "doi_source": "CITATION.cff",
        "metadata_consistency": "aligned",
        "note": null
      },
      "entrypoints": [
        "README.md",
        "machine/publication-metadata.json",
        "machine/files-manifest.json",
        "schema.org.jsonld"
      ]
    },
    {
      "repository": "Kot141078/c-governed-cli-agent-mesh",
      "corpus_class": "research",
      "role": "governed executable-agent protocol package",
      "lifecycle": "active",
      "authority_scope": "Canonical public CGAM package; worker-agent execution does not confer memory, identity, policy, witness, or continuity authority.",
      "current_pointer": {
        "ref_type": "branch",
        "ref": "main",
        "branch_url": "https://github.com/Kot141078/c-governed-cli-agent-mesh/tree/main",
        "raw_branch_base": "https://raw.githubusercontent.com/Kot141078/c-governed-cli-agent-mesh/main/",
        "observed_head_commit": "c3b004d7439a8c608f08233fc17be1150c442b44",
        "observed_commit_url": "https://github.com/Kot141078/c-governed-cli-agent-mesh/tree/c3b004d7439a8c608f08233fc17be1150c442b44",
        "raw_observed_base": "https://raw.githubusercontent.com/Kot141078/c-governed-cli-agent-mesh/c3b004d7439a8c608f08233fc17be1150c442b44/",
        "observed_at": "2026-08-07"
      },
      "declared_release": {
        "version": "0.1.1",
        "version_source": "CITATION.cff",
        "doi": "10.5281/zenodo.20257232",
        "doi_source": "CITATION.cff",
        "metadata_consistency": "aligned",
        "note": null
      },
      "entrypoints": [
        "README.md",
        "manifests/PUBLIC_PACKAGE_MANIFEST.json",
        "schemas/SCHEMA_INDEX.json",
        "validator/SEMANTIC_RULES_INDEX.json",
        "CHECKSUM_SCOPE.json"
      ]
    },
    {
      "repository": "Kot141078/c-hardening-pack",
      "corpus_class": "research",
      "role": "earlier standalone hardening-package provenance",
      "lifecycle": "active",
      "authority_scope": "Canonical standalone v0.1 hardening package retained as package provenance; later or embedded hardening material must identify its own authority.",
      "current_pointer": {
        "ref_type": "branch",
        "ref": "main",
        "branch_url": "https://github.com/Kot141078/c-hardening-pack/tree/main",
        "raw_branch_base": "https://raw.githubusercontent.com/Kot141078/c-hardening-pack/main/",
        "observed_head_commit": "9a33e3866cde19939be22a903967bc94f566db76",
        "observed_commit_url": "https://github.com/Kot141078/c-hardening-pack/tree/9a33e3866cde19939be22a903967bc94f566db76",
        "raw_observed_base": "https://raw.githubusercontent.com/Kot141078/c-hardening-pack/9a33e3866cde19939be22a903967bc94f566db76/",
        "observed_at": "2026-08-07"
      },
      "declared_release": {
        "version": "v0.1",
        "version_source": "CITATION.cff",
        "doi": "10.5281/zenodo.20348436",
        "doi_source": "CITATION.cff",
        "metadata_consistency": "aligned",
        "note": null
      },
      "entrypoints": [
        "README.md",
        "manifest.json",
        "manifests/PACKAGE_MANIFEST.json",
        "manifests/SHA256SUMS.txt",
        "CHECKSUM_DOMAIN.json"
      ]
    },
    {
      "repository": "Kot141078/cleanroom-arm-p-open-verification",
      "corpus_class": "research_software",
      "role": "open verification release and fixture plane",
      "lifecycle": "active",